{
  "$schema": "https://json-schema.org/draft/2020-12/schema",
  "$id": "schemas/attendance.schema.json",
  "title": "Richmond Recreation Attendance",
  "description": "Program registration history, membership/facility drop-in scans, and activity outcome records from City of Richmond Recreation.",
  "type": "object",
  "additionalProperties": false,
  "required": ["meta", "programHistory", "membershipScans", "activityOutcomes"],
  "properties": {
    "meta": {
      "type": "object",
      "additionalProperties": false,
      "required": ["source", "generatedAt", "timezone"],
      "properties": {
        "source": {
          "type": "string",
          "const": "City of Richmond Recreation"
        },
        "generatedAt": {
          "type": "string",
          "format": "date-time",
          "description": "UTC timestamp when this JSON file was generated."
        },
        "timezone": {
          "type": "string",
          "const": "America/Vancouver",
          "description": "Wall-clock timezone for membershipScans.timeAttended values."
        }
      }
    },
    "programHistory": {
      "type": "array",
      "description": "Registered-and-attended programs from Attendance-History.csv (status Booked only). No timestamps.",
      "items": {
        "$ref": "#/$defs/programHistoryItem"
      }
    },
    "membershipScans": {
      "type": "array",
      "description": "Drop-in / facility access scans from Attendance-Membership Scanning.csv.",
      "items": {
        "$ref": "#/$defs/membershipScanItem"
      }
    },
    "activityOutcomes": {
      "type": "array",
      "description": "Activity-Outcomes paste: eventId, activity, createdDate only.",
      "items": {
        "$ref": "#/$defs/activityOutcomeItem"
      }
    },
    "personInformation": {
      "type": "object",
      "additionalProperties": false,
      "required": ["firstName", "lastName", "birthDate"],
      "description": "Optional MyRichmond Client Information paste. Only First Name, Last Name, Birthdate; Account and Age discarded.",
      "properties": {
        "firstName": {
          "type": "string",
          "minLength": 1
        },
        "lastName": {
          "type": "string",
          "minLength": 1
        },
        "birthDate": {
          "type": "string",
          "format": "date",
          "description": "ISO 8601 date (YYYY-MM-DD)."
        }
      }
    }
  },
  "$defs": {
    "programHistoryItem": {
      "type": "object",
      "additionalProperties": false,
      "required": ["subject", "sourceRowNumber"],
      "description": "A Booked program from Attendance-History.csv.",
      "properties": {
        "subject": {
          "type": "string",
          "minLength": 1,
          "description": "Program or activity name."
        },
        "sourceRowNumber": {
          "type": "integer",
          "minimum": 1,
          "description": "Original RowNumber from the CSV export."
        }
      }
    },
    "membershipScanItem": {
      "type": "object",
      "additionalProperties": false,
      "required": [
        "timeAttended",
        "subject",
        "facility",
        "membershipPass",
        "sourceRowNumber"
      ],
      "properties": {
        "timeAttended": {
          "type": "string",
          "pattern": "^\\d{4}-\\d{2}-\\d{2}T\\d{2}:\\d{2}:\\d{2}$",
          "description": "Local America/Vancouver wall time as YYYY-MM-DDTHH:mm:ss (no offset)."
        },
        "subject": {
          "type": "string",
          "minLength": 1,
          "description": "Scan / drop-in activity type."
        },
        "facility": {
          "type": "string",
          "minLength": 1,
          "description": "Facility name (first Name column in the CSV)."
        },
        "membershipPass": {
          "type": "string",
          "minLength": 1,
          "description": "Membership or pass used (second Name column in the CSV)."
        },
        "sourceRowNumber": {
          "type": "integer",
          "minimum": 1,
          "description": "Original RowNumber from the CSV export."
        }
      }
    },
    "activityOutcomeItem": {
      "type": "object",
      "additionalProperties": false,
      "required": ["eventId", "activity", "createdDate"],
      "description": "One Activity-Outcomes row: eventId, activity, createdDate.",
      "properties": {
        "eventId": {
          "type": "string",
          "pattern": "^\\d+$",
          "description": "Event Id (string to preserve leading zeros)."
        },
        "activity": {
          "type": "string",
          "minLength": 1,
          "description": "Activity name, e.g. SWIM - SWIMMER 3 - CHILDREN."
        },
        "createdDate": {
          "type": "string",
          "pattern": "^\\d{4}-\\d{2}-\\d{2}$",
          "description": "Created Date as YYYY-MM-DD (source uses M/D/YY)."
        }
      }
    }
  }
}
